{
  "container_digest": "sha256:test",
  "dataset_manifest_sha256": "dddddddddddddddddddddddddddddddddddddddddddddddddddddddddddddddd",
  "determinism": {
    "cudnn_deterministic": true,
    "deterministic_algorithms": true,
    "numpy_seeded": true,
    "python_seeded": true,
    "tf32_disabled": true,
    "torch_seeded": true
  },
  "experiment_sha256": "eeeeeeeeeeeeeeeeeeeeeeeeeeeeeeeeeeeeeeeeeeeeeeeeeeeeeeeeeeeeeeee",
  "hardware": {
    "platform": "test"
  },
  "initialization_policy_sha256": "bbbbbbbbbbbbbbbbbbbbbbbbbbbbbbbbbbbbbbbbbbbbbbbbbbbbbbbbbbbbbbbb",
  "metrics": {
    "validation_loss": 0.4
  },
  "model_state_sha256": "ffffffffffffffffffffffffffffffffffffffffffffffffffffffffffffffff",
  "resumed_from_run_id": null,
  "run_id": "attempt-4",
  "schema_version": "3.0",
  "seed": 42,
  "tokenizer_sha256": "aaaaaaaaaaaaaaaaaaaaaaaaaaaaaaaaaaaaaaaaaaaaaaaaaaaaaaaaaaaaaaaa",
  "training_plan_sha256": "cccccccccccccccccccccccccccccccccccccccccccccccccccccccccccccccc"
}
